{
  "version": 1,
  "nodes": {
    "node-canvas-readme": {
      "x": 0,
      "y": 0,
      "width": 560,
      "height": 300
    },
    "node-game-asset-index": {
      "x": 600,
      "y": 0,
      "width": 700,
      "height": 300
    },
    "section-1-54af9f57": {
      "x": 0,
      "y": 340,
      "width": 340,
      "height": 260
    },
    "char-rinne-idle": {
      "x": 370,
      "y": 340,
      "width": 330,
      "height": 280
    },
    "char-rinne-attack": {
      "x": 730,
      "y": 340,
      "width": 330,
      "height": 280
    },
    "char-rinne-down": {
      "x": 1090,
      "y": 340,
      "width": 330,
      "height": 280
    },
    "char-homura-sword-idle": {
      "x": 1450,
      "y": 340,
      "width": 330,
      "height": 280
    },
    "char-homura-sword-attack": {
      "x": 1810,
      "y": 340,
      "width": 330,
      "height": 280
    },
    "char-homura-sword-down": {
      "x": 2170,
      "y": 340,
      "width": 330,
      "height": 280
    },
    "char-homura-mage-idle": {
      "x": 2530,
      "y": 340,
      "width": 330,
      "height": 280
    },
    "char-homura-mage-attack": {
      "x": 370,
      "y": 640,
      "width": 330,
      "height": 280
    },
    "char-homura-mage-down": {
      "x": 730,
      "y": 640,
      "width": 330,
      "height": 280
    },
    "char-mint-idle": {
      "x": 1090,
      "y": 640,
      "width": 330,
      "height": 280
    },
    "char-mint-attack": {
      "x": 1450,
      "y": 640,
      "width": 330,
      "height": 280
    },
    "char-mint-down": {
      "x": 1810,
      "y": 640,
      "width": 330,
      "height": 280
    },
    "char-guard-idle": {
      "x": 2170,
      "y": 640,
      "width": 330,
      "height": 280
    },
    "char-guard-attack": {
      "x": 2530,
      "y": 640,
      "width": 330,
      "height": 280
    },
    "char-guard-down": {
      "x": 370,
      "y": 940,
      "width": 330,
      "height": 280
    },
    "char-healer-idle": {
      "x": 730,
      "y": 940,
      "width": 330,
      "height": 280
    },
    "char-healer-attack": {
      "x": 1090,
      "y": 940,
      "width": 330,
      "height": 280
    },
    "char-healer-down": {
      "x": 1450,
      "y": 940,
      "width": 330,
      "height": 280
    },
    "char-controller-idle": {
      "x": 1810,
      "y": 940,
      "width": 330,
      "height": 280
    },
    "char-controller-attack": {
      "x": 2170,
      "y": 940,
      "width": 330,
      "height": 280
    },
    "char-controller-down": {
      "x": 2530,
      "y": 940,
      "width": 330,
      "height": 280
    },
    "section-2-18bf3315": {
      "x": 0,
      "y": 1330,
      "width": 340,
      "height": 260
    },
    "enemy-ch1-hound": {
      "x": 370,
      "y": 1330,
      "width": 330,
      "height": 280
    },
    "enemy-ch1-shield-soldier": {
      "x": 730,
      "y": 1330,
      "width": 330,
      "height": 280
    },
    "enemy-ch1-fire-spirit": {
      "x": 1090,
      "y": 1330,
      "width": 330,
      "height": 280
    },
    "enemy-ch1-cultist": {
      "x": 1450,
      "y": 1330,
      "width": 330,
      "height": 280
    },
    "enemy-ch1-elite-shield-soldier": {
      "x": 1810,
      "y": 1330,
      "width": 330,
      "height": 280
    },
    "enemy-ch1-gatekeeper": {
      "x": 2170,
      "y": 1330,
      "width": 330,
      "height": 280
    },
    "section-3-25bccb54": {
      "x": 0,
      "y": 1720,
      "width": 340,
      "height": 260
    },
    "enemy-saga-exit-relay": {
      "x": 370,
      "y": 1720,
      "width": 330,
      "height": 280
    },
    "enemy-saga-final-recoil": {
      "x": 730,
      "y": 1720,
      "width": 330,
      "height": 280
    },
    "enemy-saga-linked-anchors": {
      "x": 1090,
      "y": 1720,
      "width": 330,
      "height": 280
    },
    "enemy-saga-mirror-lamp": {
      "x": 1450,
      "y": 1720,
      "width": 330,
      "height": 280
    },
    "enemy-saga-shard-bearer": {
      "x": 1810,
      "y": 1720,
      "width": 330,
      "height": 280
    },
    "enemy-saga-soldier-shadow": {
      "x": 2170,
      "y": 1720,
      "width": 330,
      "height": 280
    },
    "enemy-saga-voice-general": {
      "x": 2530,
      "y": 1720,
      "width": 330,
      "height": 280
    },
    "enemy-saga-warden-master": {
      "x": 370,
      "y": 2020,
      "width": 330,
      "height": 280
    },
    "section-4-b089f6b0": {
      "x": 0,
      "y": 2410,
      "width": 340,
      "height": 260
    },
    "npc-ch1-liang-world": {
      "x": 370,
      "y": 2410,
      "width": 330,
      "height": 280
    },
    "npc-ch1-liang-half": {
      "x": 730,
      "y": 2410,
      "width": 330,
      "height": 280
    },
    "npc-ch1-acheng-world": {
      "x": 1090,
      "y": 2410,
      "width": 330,
      "height": 280
    },
    "npc-ch1-acheng-half": {
      "x": 1450,
      "y": 2410,
      "width": 330,
      "height": 280
    },
    "section-5-998abd13": {
      "x": 0,
      "y": 2800,
      "width": 340,
      "height": 260
    },
    "npc-saga-axing-taoshen": {
      "x": 370,
      "y": 2800,
      "width": 330,
      "height": 280
    },
    "npc-saga-fangcheng-chenkui": {
      "x": 730,
      "y": 2800,
      "width": 330,
      "height": 280
    },
    "npc-saga-fangsu-chenqiao": {
      "x": 1090,
      "y": 2800,
      "width": 330,
      "height": 280
    },
    "npc-saga-limao-xucheng": {
      "x": 1450,
      "y": 2800,
      "width": 330,
      "height": 280
    },
    "npc-saga-luoshen-aliu": {
      "x": 1810,
      "y": 2800,
      "width": 330,
      "height": 280
    },
    "npc-saga-luowei-bingvendor": {
      "x": 2170,
      "y": 2800,
      "width": 330,
      "height": 280
    },
    "npc-saga-mengheng-shenzhuzhou": {
      "x": 2530,
      "y": 2800,
      "width": 330,
      "height": 280
    },
    "npc-saga-qiaobo-xuzhaoyi": {
      "x": 370,
      "y": 3100,
      "width": 330,
      "height": 280
    },
    "npc-saga-qiuan-zhaoyigong": {
      "x": 730,
      "y": 3100,
      "width": 330,
      "height": 280
    },
    "npc-saga-songpo-duping": {
      "x": 1090,
      "y": 3100,
      "width": 330,
      "height": 280
    },
    "npc-saga-wuji-luyun": {
      "x": 1450,
      "y": 3100,
      "width": 330,
      "height": 280
    },
    "npc-saga-yaoqin-duying": {
      "x": 1810,
      "y": 3100,
      "width": 330,
      "height": 280
    },
    "section-6-16727e71": {
      "x": 0,
      "y": 3490,
      "width": 340,
      "height": 260
    },
    "bg-approach-battle": {
      "x": 370,
      "y": 3490,
      "width": 330,
      "height": 280
    },
    "bg-approach-l2-test": {
      "x": 730,
      "y": 3490,
      "width": 330,
      "height": 280
    },
    "bg-corridor-battle": {
      "x": 1090,
      "y": 3490,
      "width": 330,
      "height": 280
    },
    "bg-corridor-walk": {
      "x": 1450,
      "y": 3490,
      "width": 330,
      "height": 280
    },
    "bg-honden-battle": {
      "x": 1810,
      "y": 3490,
      "width": 330,
      "height": 280
    },
    "bg-honden-dusk": {
      "x": 2170,
      "y": 3490,
      "width": 330,
      "height": 280
    },
    "bg-mountain-far": {
      "x": 2530,
      "y": 3490,
      "width": 330,
      "height": 280
    },
    "bg-mountain-arch": {
      "x": 370,
      "y": 3790,
      "width": 330,
      "height": 280
    },
    "section-7-d05fddfd": {
      "x": 0,
      "y": 4180,
      "width": 340,
      "height": 260
    },
    "bg-parallax-approach-fg1": {
      "x": 370,
      "y": 4180,
      "width": 330,
      "height": 280
    },
    "bg-parallax-corridor-fg1": {
      "x": 730,
      "y": 4180,
      "width": 330,
      "height": 280
    },
    "bg-parallax-honden-fg1": {
      "x": 1090,
      "y": 4180,
      "width": 330,
      "height": 280
    },
    "bg-parallax-mountain-fg1": {
      "x": 1450,
      "y": 4180,
      "width": 330,
      "height": 280
    },
    "section-8-f55c19de": {
      "x": 0,
      "y": 4570,
      "width": 340,
      "height": 260
    },
    "bg-occluder-honden": {
      "x": 370,
      "y": 4570,
      "width": 330,
      "height": 280
    },
    "bg-occluder-approach-o0": {
      "x": 730,
      "y": 4570,
      "width": 330,
      "height": 280
    },
    "bg-occluder-approach-o1": {
      "x": 1090,
      "y": 4570,
      "width": 330,
      "height": 280
    },
    "section-9-13254b13": {
      "x": 0,
      "y": 4960,
      "width": 340,
      "height": 260
    },
    "bg-walkmask-approach": {
      "x": 370,
      "y": 4960,
      "width": 330,
      "height": 280
    },
    "bg-walkmask-corridor": {
      "x": 730,
      "y": 4960,
      "width": 330,
      "height": 280
    },
    "bg-walkmask-honden": {
      "x": 1090,
      "y": 4960,
      "width": 330,
      "height": 280
    },
    "bg-walkmask-mountain": {
      "x": 1450,
      "y": 4960,
      "width": 330,
      "height": 280
    },
    "section-10-f64f629d": {
      "x": 0,
      "y": 5350,
      "width": 340,
      "height": 260
    },
    "stage-act01-approach-glb": {
      "x": 370,
      "y": 5350,
      "width": 330,
      "height": 280
    },
    "stage-night02-corridor-glb": {
      "x": 730,
      "y": 5350,
      "width": 330,
      "height": 280
    },
    "stage-night02-corridor-hd2d-glb": {
      "x": 1090,
      "y": 5350,
      "width": 330,
      "height": 280
    },
    "stage-night03-procession-glb": {
      "x": 1450,
      "y": 5350,
      "width": 330,
      "height": 280
    },
    "stage-night04-mirror-glb": {
      "x": 1810,
      "y": 5350,
      "width": 330,
      "height": 280
    },
    "stage-night05-honden-glb": {
      "x": 2170,
      "y": 5350,
      "width": 330,
      "height": 280
    },
    "section-11-e2816cde": {
      "x": 0,
      "y": 5740,
      "width": 340,
      "height": 260
    },
    "tex-night02-corridor-paper": {
      "x": 370,
      "y": 5740,
      "width": 330,
      "height": 280
    },